{
	"$schema": "http://json-schema.org/draft-07/schema",
	"$id": "https://notwoods.github.io/fiascomatic/deck-schema.json",
	"type": "object",
	"title": "Fiascomatic deck",
	"description": "All the possible cards/tables inside a Fiasco deck.",
	"required": ["tables", "title"],
	"properties": {
		"title": {
			"$id": "#/properties/title",
			"type": "string",
			"title": "Set title",
			"description": "Title presented throughout the app",
			"examples": ["News Channel Six"]
		},
		"subtitle": {
			"$id": "#/properties/subtitle",
			"type": "string",
			"title": "Set subtitle",
			"description": "Subtitle displayed under table lists",
			"default": "",
			"examples": ["...AT NEWS CHANNEL SIX"]
		},
		"backgroundColor": {
			"$id": "#/properties/backgroundColor",
			"type": "string",
			"title": "Set background color",
			"description": "Color displayed behind the logo.",
			"pattern": "^#[a-fA-F0-9]{6}$",
			"default": "#4d0000",
			"examples": ["#22689B"]
		},
		"tables": {
			"$id": "#/properties/tables",
			"title": "Deck tables",
			"description": "Splits up the deck into subsections for relationships, needs, locations, and objects.",
			"anyOf": [
				{
					"required": ["location", "need", "object", "relationship"],
					"properties": {
						"location": { "$ref": "./table-schema.json" },
						"need": { "$ref": "./table-schema.json" },
						"object": { "$ref": "./table-schema.json" },
						"relationship": { "$ref": "./table-schema.json" }
					}
				},
				{
					"required": ["locations", "needs", "objects", "relationships"],
					"properties": {
						"locations": { "$ref": "./table-schema.json" },
						"needs": { "$ref": "./table-schema.json" },
						"objects": { "$ref": "./table-schema.json" },
						"relationships": { "$ref": "./table-schema.json" }
					}
				}
			],
			"examples": [
				{
					"relationship": {
						"title": "Relationships...",
						"categories": [
							{
								"name": "ACTION SIX NEWS TEAM",
								"elements": ["Work rivals"]
							},
							{
								"name": "FAMILY",
								"elements": ["Currently married"]
							},
							{
								"name": "FOOLING AROUND",
								"elements": ["“Secret” lovers only to yourselves"]
							},
							{
								"name": "WE’VE GOT HISTORY",
								"elements": ["“I know a secret about you”"]
							}
						]
					},
					"need": {
						"title": "Needs...",
						"categories": [
							{
								"name": "TO GET LAID",
								"elements": ["Constantly"]
							},
							{
								"name": "TO GET FAMOUS",
								"elements": ["By going out with a bang"]
							},
							{
								"name": "TO GET RICH",
								"elements": ["Through a secret I learned at work"]
							}
						]
					},
					"object": {
						"title": "Objects...",
						"categories": [
							{
								"name": "TOOLS OF THE TRADE",
								"elements": ["Sky Chopper Six!"]
							},
							{
								"name": "PROPS",
								"elements": ["High-powered model rocket", "Giant pot of boiling soup"]
							}
						]
					},
					"location": {
						"title": "Locations...",
						"categories": [
							{
								"name": "HARD NEWS",
								"elements": [
									"At the scene of a grisly murder/suicide",
									"In the trailer park just after the tornado hit"
								]
							}
						]
					}
				}
			]
		},
		"score": {
			"type": "string",
			"title": "The Score",
			"description": "Setting for the deck"
		},
		"kickers": {
			"type": "array",
			"title": "Kickers",
			"description": "Feel free to steal one of these options for a Scene to Establish. Think about what you want for your character!",
			"default": [],
			"items": {
				"type": "string"
			}
		},
		"names": {
			"type": "array",
			"title": "Names",
			"description": "Pool of character names to use",
			"default": [],
			"items": {
				"type": "string"
			}
		}
	}
}
